{
  "epoch": 13,
  "kind": "proofrail.trust-checkpoint.v0.5.1",
  "monotonic_counter": 35,
  "previous_checkpoint_hash": "539a6708890c62ce1e735abe36edc4b5f699b8ef5532e45223200d6268d747ab",
  "record_hash": "a628e24977cd24e6554c75ea742b8f5e35991dc685e43b06b6765ef22845fc3d",
  "roots": {
    "ledger_checkpoint": "f2285d77ed5c06bccd329ea92f4cd58e7eca5139aae4d0e43864dc8788742559",
    "observation": "7c4e029cb5a28631678a04bf72a08e4e4c90741bdaef154d5e3b65abd28f9131",
    "replay": "aeb98f321612347458aebed4515026c480e9cd98647b0e525fb91b1b32e38471"
  },
  "signature": {
    "algorithm": "ed25519",
    "key_id": "reproduce-trust-checkpoint",
    "value": "dXQr0xEIt0bx0fKOIUGXzLPn9clyLPeD1Rv-qNmYI0BYM1ScOrZhhWVdINrF6MlBNDp_OgTqteZGzRBDwf45Dw"
  },
  "trust_root": "e1fdc7ad1a8292bcefffa99fda9feb8d86f23aa27da8572ec36070b2f1978115"
}
